id;name;path_to_image;address;information;lat_lng
1;МГУ;/images/msu.jpg;Москва, Ленинские горы, 1, главный корпус МГУ;крупнейший университет России;55.7022 37.5300
2;МФТИ;/images/mipt.jpg;Москва, Институтский пер., 9;известен своими исследованиями в области физики и технологий;55.8886 37.4839
3;ВШЭ;/images/hse.jpg;Москва, Мясницкая ул., 20;один из ведущих вузов России, специализируется на экономике и социальных науках;55.7619 37.6176
4;МИСИС;/images/miss.jpg;Москва, Ленинский пр., 4;специализируется на подготовке специалистов в области металлургии и материаловедения;55.7464 37.5863
5;РУДН;/images/rudn.jpg;Москва, Московский пр., 6;университет, ориентированный на международное сотрудничество и многонациональное обучение;55.6304 37.5382
