name;address;phone_number;about;latitude;longitude
Донволонтер;Нижнебульварная ул., 6, Ростов-на-Дону;+7 (863) 285-04-21;💜Ресурсный центр добровольчества Донского региона.;47.217210;39.722854
Центр помощи детям;ул. Детская, 5, Москва;+74951234567;Предоставляем помощь детям из неблагополучных семей. Помощь в образовании и социальной адаптации.;55.7558;37.6176
Благотворительный приют для бездомных;ул. Бездомных, 12, Санкт-Петербург;+78123456789;Приют для бездомных, предоставляем ночлег, еду и помощь в поиске работы.;59.9343;30.3351
Центр экологии и защиты природы;ул. Лесная, 14, Новосибирск;+73832345678;Экологическая организация, занимаемся озеленением, уборкой территорий и защитой животных.;54.9912;82.9311
Ресурсный центр поддержки женщин;ул. Протежки, 9, Казань;+78433567890;Предоставляем убежище и юридическую помощь женщинам, попавшим в трудные жизненные ситуации.;55.8300;49.0661
Центр помощи пожилым людям;ул. Стариков, 8, Екатеринбург;+73433789012;Помогаем пожилым людям в быту, предоставляем психологическую помощь и социальную поддержку.;56.8389;60.6057
Кризисный центр для молодежи;ул. Молодежная, 3, Ростов-на-Дону;+78632345678;Поддержка молодежи, попавшей в трудные жизненные ситуации, помощь в обучении и трудоустройстве.;47.2357;39.7015
Центр помощи животным;ул. Зоологическая, 17, Краснодар;+78612678901;Занимаемся спасением и реабилитацией бездомных животных, ищем им новый дом.;45.0350;38.9760